{"metadata":{"dataset":"World Bank Poverty and Inequality Platform (PIP) \u2014 Percentiles","version":"v2026 (PIP snapshot 2026-06-26)","demo":false,"source":"World Bank PIP via Our World in Data catalog mirror","sourceUrl":"https://datacatalog.worldbank.org/search/dataset/0063646","license":"CC0 (PIP Percentiles); OWID processing CC-BY","referenceYear":"latest survey year per economy (see distributions[].year), constant 2021 int-$","pppBasis":"2021 PPP international dollars; conversion PA.NUS.PRVT.PP (LCU per int-$, private consumption)","incomeDefinition":"household disposable income or consumption, per capita","methodology":"country: 99-threshold percentile lookup, log-linear interpolation, capped at Top 1%; world: pooled population-weighted country bins ordered by welfare (not an average of country percentiles)","world_population":7941270897,"generatedAt":"2026-08-18T20:35:07+00:00","countries":171,"limitations":["Survey welfare is household income/consumption per capita; user input is personal gross income.","Survey years differ by economy; pooled world mixes latest years in constant 2021 int-$.","Household surveys under-cover the extreme top tail; results cap at Top 1%.","Non-local currency entry uses the issuing economy's PPP factor (disclosed in UI)."]},"world":{"thresholds":[0.9041,1.2634,1.5453,1.801,1.987,2.2064,2.4042,2.5942,2.7487,2.9131,3.0605,3.202,3.3525,3.4856,3.6121,3.7476,3.8693,3.9745,4.121,4.2081,4.3298,4.4527,4.5815,4.681,4.7893,4.9105,5.029,5.1339,5.2465,5.3958,5.5075,5.6358,5.7833,5.881,6.0223,6.18,6.3156,6.4591,6.6086,6.7529,6.9225,7.0982,7.2725,7.4565,7.6311,7.8135,8.0706,8.2615,8.4744,8.7037,8.9658,9.1891,9.4686,9.7325,9.9891,10.3148,10.658,10.9405,11.3398,11.6126,11.9901,12.472,12.8607,13.3086,13.7302,14.3202,14.8457,15.2737,16.0064,16.6184,17.4071,18.0301,18.7038,19.6367,20.6166,21.5151,22.6303,23.8053,25.16,26.662,28.0848,29.498,31.7241,33.4903,35.8853,38.1393,40.8862,43.7106,47.4045,50.9473,54.8183,59.7405,65.3506,70.8079,78.6404,88.3741,99.1819,118.1892,158.379],"welfare_type":"mixed"},"ppp":{"AF":15.9898,"AL":52.2405,"DZ":39.3659,"AD":0.6391,"AO":203.6887,"AG":2.1422,"AR":42.9862,"AM":164.2265,"AU":1.5043,"AT":0.7517,"AZ":0.4828,"BS":1.1725,"BH":0.2087,"BD":29.2149,"BB":2.6373,"BY":0.7396,"BE":0.7999,"BZ":1.1165,"BJ":219.0111,"BT":21.3612,"BO":2.4478,"BA":0.7621,"BW":5.0984,"BR":2.4499,"BN":0.6064,"BG":0.3848,"BF":192.5042,"BI":657.4093,"CV":54.4045,"KH":1577.4142,"CM":201.4929,"CA":1.2439,"CF":276.3265,"TD":215.8571,"CL":481.1307,"CN":4.0128,"CO":1546.664,"KM":228.0478,"CD":928.6025,"CG":242.334,"CR":363.3302,"CI":238.54,"HR":0.4806,"CY":0.6416,"CZ":14.8021,"DK":7.2558,"DJ":96.9308,"DM":1.6263,"DO":23.1358,"EC":0.4853,"EG":4.1145,"SV":0.4943,"GQ":287.6907,"ER":5.1967,"EE":0.6308,"SZ":6.189,"ET":13.4368,"FJ":0.9449,"FI":0.8719,"FR":0.7922,"GA":300.235,"GM":15.4242,"GE":1.0735,"DE":0.7427,"GH":2.4542,"GR":0.6046,"GD":1.8509,"GT":3.443,"GN":3221.2612,"GW":217.9847,"GY":99.4597,"HT":53.0312,"HN":11.7821,"HK":6.3883,"HU":169.3446,"IS":155.8426,"IN":19.469,"ID":5353.5596,"IR":48021.043,"IQ":575.5928,"IE":0.9585,"IL":4.048,"IT":0.6999,"JM":90.6734,"JP":109.4444,"JO":0.3441,"KZ":142.3611,"KE":42.428,"KI":0.9171,"KR":960.9882,"KW":0.1919,"KG":24.3161,"LA":3260.2532,"LV":0.5207,"LB":4792.2441,"LS":5.8172,"LR":0.4568,"LY":1.9151,"LT":0.496,"LU":0.9607,"MG":1131.7112,"MW":282.0942,"MY":1.5549,"MV":10.2487,"ML":192.8615,"MT":0.6348,"MH":0.9521,"MR":12.116,"MU":18.7661,"MX":11.2083,"FM":0.9495,"MD":6.3328,"MN":957.8393,"ME":0.4109,"MA":4.091,"MZ":23.6232,"MM":499.6977,"NA":7.239,"NR":1.1435,"NP":33.8332,"NL":0.8001,"NZ":1.5573,"NI":12.5824,"NE":210.6579,"NG":155.7235,"MK":20.8911,"NO":9.9572,"OM":0.2057,"PK":42.5277,"PW":0.8875,"PS":0.6214,"PA":0.5629,"PG":2.903,"PY":2754.5078,"PE":1.9181,"PH":20.7462,"PL":1.9128,"PT":0.6125,"QA":2.9119,"RO":1.9086,"RU":25.7555,"RW":291.5977,"KN":2.2698,"LC":1.6434,"VC":1.7285,"WS":1.7888,"SM":0.7572,"ST":9.6174,"SA":2.0437,"SN":226.5763,"RS":48.5413,"SC":9.8318,"SL":3.1707,"SG":1.0589,"SK":0.5709,"SI":0.6037,"SB":7.5468,"SO":10392.249,"ZA":7.5245,"SS":158.0521,"ES":0.6545,"LK":58.2961,"SD":101.4338,"SR":6.335,"SE":9.0464,"CH":1.2446,"SY":506.8637,"TJ":3.2183,"TZ":681.8509,"TH":11.7121,"TL":0.4455,"TG":220.6677,"TO":1.7353,"TT":4.0619,"TN":0.8731,"TR":3.0765,"TM":1.5722,"TV":1.2944,"UG":1315.2677,"UA":8.6627,"AE":2.7276,"GB":0.7355,"US":1.0,"UY":28.0055,"UZ":2906.5815,"VU":120.3516,"VN":7510.8223,"ZM":6.1896,"ZW":0.029,"XK":0.3937},"currency_ppp":{"USD":1.0,"GBP":0.7355,"XOF":238.54,"XAF":201.4929,"XCD":1.6434,"AUD":1.5043,"CHF":1.2446,"ILS":4.048,"AFN":15.9898,"ALL":52.2405,"DZD":39.3659,"EUR":0.6391,"AOA":203.6887,"ARS":42.9862,"AMD":164.2265,"AZN":0.4828,"BSD":1.1725,"BHD":0.2087,"BDT":29.2149,"BBD":2.6373,"BYN":0.7396,"BZD":1.1165,"BTN":21.3612,"BOB":2.4478,"BAM":0.7621,"BWP":5.0984,"BRL":2.4499,"BND":0.6064,"BGN":0.3848,"BIF":657.4093,"CVE":54.4045,"KHR":1577.4142,"CAD":1.2439,"CLP":481.1307,"CNY":4.0128,"COP":1546.664,"KMF":228.0478,"CDF":928.6025,"CRC":363.3302,"CZK":14.8021,"DKK":7.2558,"DJF":96.9308,"DOP":23.1358,"EGP":4.1145,"ERN":5.1967,"SZL":6.189,"ETB":13.4368,"FJD":0.9449,"GMD":15.4242,"GEL":1.0735,"GHS":2.4542,"GTQ":3.443,"GNF":3221.2612,"GYD":99.4597,"HTG":53.0312,"HNL":11.7821,"HKD":6.3883,"HUF":169.3446,"ISK":155.8426,"INR":19.469,"IDR":5353.5596,"IRR":48021.043,"IQD":575.5928,"JMD":90.6734,"JPY":109.4444,"JOD":0.3441,"KZT":142.3611,"KES":42.428,"KRW":960.9882,"KWD":0.1919,"KGS":24.3161,"LAK":3260.2532,"LBP":4792.2441,"LSL":5.8172,"LRD":0.4568,"LYD":1.9151,"MGA":1131.7112,"MWK":282.0942,"MYR":1.5549,"MVR":10.2487,"MRU":12.116,"MUR":18.7661,"MXN":11.2083,"MDL":6.3328,"MNT":957.8393,"MAD":4.091,"MZN":23.6232,"MMK":499.6977,"NAD":7.239,"NPR":33.8332,"NZD":1.5573,"NIO":12.5824,"NGN":155.7235,"MKD":20.8911,"NOK":9.9572,"OMR":0.2057,"PKR":42.5277,"PAB":0.5629,"PGK":2.903,"PYG":2754.5078,"PEN":1.9181,"PHP":20.7462,"PLN":1.9128,"QAR":2.9119,"RON":1.9086,"RUB":25.7555,"RWF":291.5977,"WST":1.7888,"STN":9.6174,"SAR":2.0437,"RSD":48.5413,"SCR":9.8318,"SLE":3.1707,"SGD":1.0589,"SBD":7.5468,"SOS":10392.249,"ZAR":7.5245,"SSP":158.0521,"LKR":58.2961,"SDG":101.4338,"SRD":6.335,"SEK":9.0464,"SYP":506.8637,"TJS":3.2183,"TZS":681.8509,"THB":11.7121,"TOP":1.7353,"TTD":4.0619,"TND":0.8731,"TRY":3.0765,"TMT":1.5722,"UGX":1315.2677,"UAH":8.6627,"AED":2.7276,"UYU":28.0055,"UZS":2906.5815,"VUV":120.3516,"VND":7510.8223,"ZMW":6.1896,"ZWG":0.029},"distributions":{"AO":{"thresholds":[0.4419,0.5965,0.7028,0.7838,0.8652,0.9425,1.0108,1.0677,1.1479,1.2188,1.2829,1.3397,1.3857,1.4431,1.5012,1.5697,1.6336,1.6864,1.7436,1.8049,1.8565,1.903,1.9512,2.007,2.0718,2.1238,2.19,2.2425,2.3188,2.377,2.432,2.5089,2.5825,2.6362,2.6921,2.7554,2.8219,2.884,2.9715,3.0521,3.1375,3.2246,3.2967,3.38,3.4753,3.5511,3.6245,3.7199,3.8176,3.8795,3.9694,4.0531,4.1479,4.2214,4.3183,4.4296,4.5315,4.638,4.7381,4.8465,4.9757,5.1042,5.2218,5.3843,5.5151,5.6561,5.7545,5.9068,6.0737,6.2411,6.4325,6.6101,6.7786,6.9881,7.139,7.3813,7.5585,7.7723,8.0074,8.2998,8.5695,8.8503,9.1174,9.4735,9.7434,10.0663,10.5032,11.0071,11.4777,12.166,12.7201,13.4765,14.3989,15.6428,16.6639,17.976,20.6275,24.5666,36.6455],"year":2018,"welfare_type":"consumption","population":39040039},"AL":{"thresholds":[3.548,4.1589,4.5175,4.8322,5.2817,5.5097,5.7903,6.0543,6.2653,6.5269,6.7427,6.9151,7.1363,7.3484,7.4918,7.6467,7.8403,7.994,8.1642,8.3162,8.4264,8.5597,8.7626,8.9457,9.0662,9.2167,9.3156,9.4672,9.6285,9.8173,9.9831,10.1447,10.2978,10.4083,10.5715,10.697,10.8193,10.9593,11.1235,11.2836,11.4332,11.6062,11.7442,11.8492,11.9966,12.1959,12.3603,12.4962,12.6687,12.8386,13.0082,13.1788,13.3662,13.5228,13.6875,13.8686,14.0198,14.1834,14.3501,14.5603,14.8026,14.9796,15.2742,15.4779,15.7063,15.8622,16.083,16.3505,16.5757,16.869,17.1683,17.4083,17.7093,18.0261,18.42,18.7948,19.1633,19.5825,19.9549,20.2573,20.6818,21.1263,21.5424,21.9743,22.5141,23.0441,23.5713,24.2959,24.9916,25.672,26.4448,27.5541,28.6803,29.893,31.3225,33.403,35.912,39.1314,43.7151],"year":2020,"welfare_type":"consumption","population":2349580},"AE":{"thresholds":[10.0145,14.26,17.9785,21.2793,24.2424,26.928,29.3822,31.6409,33.7328,35.6812,37.505,39.2197,40.8386,42.3726,43.8312,45.2223,46.553,47.8292,49.0562,50.2388,51.3809,52.4863,53.5582,54.5995,55.6129,56.6007,57.5652,58.5083,59.4318,60.3374,61.2266,62.101,62.9617,63.8102,64.6474,65.4746,66.2928,67.103,67.9061,68.7031,69.4949,70.2822,71.0659,71.8469,72.6259,73.4037,74.1811,74.9589,75.7379,76.5188,77.3025,78.0897,78.8813,79.6782,80.4811,81.2912,82.1092,82.9361,83.7732,84.6213,85.4818,86.3558,87.2447,88.1499,89.073,90.0157,90.9796,91.9669,92.9797,94.0204,95.0915,96.1961,97.3374,98.519,99.745,101.02,102.3494,103.7391,105.196,106.7283,108.3451,110.0576,111.8787,113.8241,115.9126,118.1673,120.6166,123.2966,126.2529,129.5453,133.2533,137.4855,142.3951,148.2071,155.2675,164.1443,175.8515,192.4357,218.9026],"year":2018,"welfare_type":"income","population":11513149},"AM":{"thresholds":[3.1214,3.4928,3.6753,3.854,4.0731,4.2517,4.3778,4.5278,4.6443,4.8231,4.9464,5.076,5.2316,5.3404,5.4575,5.5368,5.6088,5.7209,5.8208,5.9204,6.012,6.0834,6.2079,6.2924,6.384,6.4805,6.5621,6.6301,6.7238,6.7874,6.8833,6.9877,7.068,7.1468,7.2256,7.3118,7.4156,7.5015,7.5619,7.6691,7.752,7.8442,7.9175,8.0238,8.1078,8.1778,8.2708,8.3455,8.4548,8.5456,8.6183,8.7125,8.8031,8.9131,9.0173,9.0965,9.2117,9.3064,9.4233,9.5108,9.6008,9.6941,9.7738,9.8799,10.0204,10.1553,10.3093,10.4484,10.5645,10.6703,10.811,10.9185,11.0823,11.2592,11.4119,11.5817,11.7216,11.9103,12.086,12.2949,12.5219,12.7148,12.9432,13.2632,13.4369,13.7244,14.1356,14.4616,14.9213,15.3271,15.8097,16.3143,17.1882,18.3444,19.2327,20.5478,22.5603,26.6133,34.2202],"year":2024,"welfare_type":"consumption","population":3086700},"AU":{"thresholds":[3.3102,12.4833,16.4819,19.135,21.078,22.8193,24.4163,25.6862,27.0606,28.0784,29.3611,30.6206,31.5549,32.7076,33.9935,34.9938,35.9231,36.8206,37.4243,38.1362,38.7172,39.3542,40.084,40.7373,41.4855,42.0648,42.753,43.6222,44.3791,45.139,45.8313,46.5716,4